status_id,status_message,link_name,status_type,status_link,status_published,num_likes,num_comments,num_shares
889307941125736_1055103691212826,"“Each and every one of us must also vote for leaders who will put the safety of our families and communities ahead of the interests of the gun lobby. Only one candidate has a proven record of doing just that – and that’s why I’m with her.”  —Lucia McBath, mother of Jordan Davis",Op-Ed: Mother of Jordan Davis Says Hillary Clinton Is 'Clear Choice' for President,link,http://www.bet.com/news/national/2016/01/19/jordan-davis-mother.html,2016-01-19 16:10:22,4792,487,490
889307941125736_1055094021213793,"Thank you, Human Rights Campaign.",Timeline Photos,photo,https://www.facebook.com/hillaryclinton/photos/a.889773484412515.1073741828.889307941125736/1055094021213793/?type=3,2016-01-19 15:55:21,7733,813,1145
889307941125736_1054970237892838,"""She is the one person who can bring a tremendous amount of experience to the job of being a world leader.""",Leadership,video,https://www.facebook.com/hillaryclinton/videos/1054970237892838/,2016-01-19 14:00:00,28931,1709,6211
889307941125736_1055007721222423,Our fight for equality must continue to ensure transgender people are treated with equal rights and dignity.,Timeline Photos,photo,https://www.facebook.com/hillaryclinton/photos/a.889773484412515.1073741828.889307941125736/1055007721222423/?type=3,2016-01-19 13:07:53,2777,355,521
889307941125736_1054964214560107,President Obama's action should be upheld so families can stay together and live without fear of deportation. -H,Supreme Court Agrees To Hear Case On Obama's Immigration Actions,link,http://ww.npr.org/sections/thetwo-way/2016/01/19/463577862/supreme-court-agrees-to-hear-case-on-obama-s-immigration-actions,2016-01-19 11:39:13,8888,386,764
889307941125736_1054942914562237,"You have fought with persistence and great courage for LGBT equality. From one ""HRC"" to another—I’m proud to have your support. -H",Human Rights Campaign,link,http://gph.is/1Ou25x6,2016-01-19 11:03:43,8590,872,2
889307941125736_1054921864564342,,Hillary Clinton,video,https://www.facebook.com/hillaryclinton/videos/1053545058035356/,2016-01-19 10:16:16,1591,248,0
889307941125736_1054510091272186,"""Not long ago, I went to Chicago to meet with a group of mothers who belong to a club no one ever wants to join. One by one, each held up a picture of a beloved child killed by gun violence or by the police. They're not looking for sympathy, they just want to spare other families from what they've endured. And they're turning their grief into a powerful call of action for the nation.

One of those women is named Sybrina Fulton. Her son was Trayvon Martin. When he was killed, she found herself thrust into the national spotlight. I've gotten to know her, and she's a private person. She really didn't want to be a spokesperson for victims of gun violence and their families. She struggled with that for a long time, but after a lot of prayers, she decided she had to act. She said, ‘I have to do my part. I have to do something to remember my son. I have to do something to try to make a difference in this world. If you want change, it starts with you.’

And so on this Martin Luther King Day, as we remember this giant from our history, let us also think of Sybrina Fulton and everyone who gets up every morning, and takes a very deep breath, and gets to work trying to make a difference in our country and the world. This holiday is theirs and yours, and I am very honored to spend it with you."" —Hillary in South Carolina at the Martin Luther King Day at the Dome rally",,status,,2016-01-18 22:15:00,7261,1099,494
889307941125736_1054592447930617,Chelsea Clinton stopped by HQ to celebrate Dr. King’s legacy through service and she teamed up with staffers to pack and deliver lunches for Hashtag Lunchbag and the Bed-Stuy Campaign Against Hunger (BSCAH).,Chelsea Clinton,photo,https://www.facebook.com/chelseaclinton/photos/a.126553854111177.17215.103551633078066/740198389413384/?type=3,2016-01-18 21:35:00,4287,544,2
889307941125736_1054590631264132,,Hillary Clinton,video,https://www.facebook.com/hillaryclinton/videos/1006746009381928/,2016-01-18 21:03:59,23875,1204,4
889307941125736_1054509701272225,"Health care. Gun violence prevention. Immigration. Throughout her entire life, Hillary’s taken on the issues that matter most—and she gets things done. #DemDebate",Let’s get one thing straight: Hillary Clinton has fought for progressive issues her entire career.,link,http://hrc.io/1KnWqVm,2016-01-18 20:21:01,16571,1091,1238
889307941125736_1054508171272378,The next president has to be able to stand up to Republicans and stop their backward agenda.,Timeline Photos,photo,https://www.facebook.com/hillaryclinton/photos/a.889773484412515.1073741828.889307941125736/1054508171272378/?type=3,2016-01-18 19:31:00,8336,728,1536
889307941125736_1054506764605852,Two weeks to Iowa!,media.giphy.com,link,https://media.giphy.com/media/3oFyDgDpYRgO4JS7Is/giphy.gif,2016-01-18 18:46:45,10602,886,718
889307941125736_1054438147946047,Caucusing for Hillary? Ask a friend to come with you on March 5! Tag them in the comments below and join thousands of Kansans in committing to support Hillary Clinton: http://hrc.io/1RPPbxG,Join me: Let’s Commit to Caucus in Kansas,link,http://hrc.io/1RPPbxG,2016-01-18 18:03:01,165,101,22
889307941125736_1054481327941729,,Hillary for New Hampshire,photo,https://www.facebook.com/HillaryforNH/photos/a.632914340186841.1073741828.630309247114017/756473171164290/?type=3,2016-01-18 17:52:02,166,138,0
889307941125736_1054418641281331,Ever wondered what it’s like backstage at the #DemDebate? Here’s a peek. Text WATCH to 47246 to get more texts from Hillary!,Did you see these behind-the-scenes texts from Hillary Clinton on debate night?,link,http://hrc.io/1RPN0u2,2016-01-18 17:26:56,3857,382,255
889307941125736_1054417527948109,"Meet Fayde, age 8, from Iowa. His favorite things are Star Wars, chocolate chip pancakes, and campaigning for Hillary Clinton.",This 8-year-old might be Hillary Clinton’s cutest fan.,link,http://hrc.io/1RPMOe0,2016-01-18 15:54:33,30953,1257,1104
889307941125736_1054360674620461,"When the children of majority-African American Flint, Michigan, have been drinking and bathing in lead-poisoned water for more than a year, making sure all Americans have clean air and water isn’t just a health issue—it’s a civil rights issue. We would be outraged if this happened to white kids, and we should be outraged that it’s happening right now to black kids.",,video,https://www.facebook.com/hillaryclinton/videos/1054360674620461/,2016-01-18 14:56:47,17448,1309,4084
889307941125736_1054335774622951,“What we have to do is protect the Obama legacy...and Hillary Clinton is that person.” -Eric Holder,Eric Holder: Hillary Clinton is the best candidate to ‘protect the Obama legacy’,link,https://www.washingtonpost.com/news/post-politics/wp/2016/01/17/eric-holder-hillary-clinton-is-the-best-candidate-to-protect-the-obama-legacy/,2016-01-18 13:41:57,16663,1285,1250
889307941125736_1054282477961614,"""If the kids in a rich suburb of Detroit had been drinking contaminated water, we would have done something about it."" —Hillary #DemDebate","What’s happening with the water in Flint, Michigan, is an outrage.",link,http://hrc.io/1PiyP9S,2016-01-18 12:02:22,393,328,79
889307941125736_1054226847967177,We can’t afford to undo President Obama’s progress. Hillary will defend and build on the Affordable Care Act.,"In one debate answer, Hillary summed up why the Affordable Care Act is such a huge accomplishment.",link,http://hrc.io/1RPk317,2016-01-18 10:22:06,22582,1623,1179
889307941125736_1053950984661430,"""If the kids in a rich suburb of Detroit had been drinking contaminated water, we would have done something about it."" —Hillary #DemDebate","What’s happening with the water in Flint, Michigan, is an outrage.",link,http://hrc.io/1ZFKbQn,2016-01-17 23:07:20,6396,972,920
889307941125736_1053947741328421,There’s only one candidate in this race who will defend—and build on—the progress that President Obama has made. #DemDebate,Let's elect a president who will defend and build on the progress we've made.,link,https://www.hillaryclinton.com/forms/progressdefend/?utm_medium=social&utm_source=fb&utm_campaign=20160117demdebate,2016-01-17 22:55:48,16529,2469,1668
889307941125736_1053917621331433,We need a president who will make quality higher education a reality for every American. #DemDebate,Timeline Photos,photo,https://www.facebook.com/hillaryclinton/photos/a.889773484412515.1073741828.889307941125736/1053917621331433/?type=3,2016-01-17 22:22:09,10886,1248,1361
889307941125736_1053901377999724,"It's wrong that black men are more likely than white men to be stopped by police, charged with crimes, and sentenced to longer prison terms. #DemDebate",,video,https://www.facebook.com/hillaryclinton/videos/1053901377999724/,2016-01-17 22:11:22,9987,1079,1700
889307941125736_1053880724668456,"We need a president who will always, always put American families over the gun lobby. #DemDebate",,video,https://www.facebook.com/hillaryclinton/videos/1053880724668456/,2016-01-17 21:33:39,19301,1830,1911
889307941125736_1053535231369672,"“We need someone who knows when to very much stand her ground, but also when common ground is possible and when you should be looking to work across the aisle.” - Chelsea Clinton",Timeline Photos,photo,https://www.facebook.com/hillaryclinton/photos/a.889773484412515.1073741828.889307941125736/1053535231369672/?type=3,2016-01-17 19:00:01,16203,1216,845
889307941125736_1053535781369617,"“Everything she touched, she made better.” -President Bill Clinton shares some of his favorite memories of Hillary",,video,https://www.facebook.com/hillaryclinton/videos/1053535781369617/,2016-01-17 17:00:00,25028,1653,2781
889307941125736_1053534391369756,"“Our first female president would send a message that we are here. We are ready to lead. In fact, she has been leading all along.” -Lena Dunham",On the road for Hillary: a travelogue,link,https://www.hillaryclinton.com/feed/road-hillary-travelogue/,2016-01-17 15:00:00,4621,531,216
889307941125736_1053567998033062,The candidates at the GOP debate made it clear that the gun lobby wouldn't have anything to worry about if a Republican is in the White House.,That time 5 Republican candidates made the case for a Democratic president,link,https://www.hillaryclinton.com/feed/time-republican-candidates-made-case-democratic-president/?utm_medium=social&utm_source=fb&utm_campaign=20160117feed_gopguns,2016-01-17 13:02:00,5121,808,396
889307941125736_1053545058035356,Millions of people like Angelina live with autism—they and their families need our support. It's time for us to devote more resources to understanding autism.,,video,https://www.facebook.com/hillaryclinton/videos/1053545058035356/,2016-01-17 11:20:00,4945,573,1586
889307941125736_1053529254703603,"""We have a lot of friends in this race, but we have one true champion."" -Cecile Richards of Planned Parenthood Action",Refinery29,video,https://www.facebook.com/refinery29/videos/10153929645197922/,2016-01-17 09:38:08,7087,685,1
889307941125736_1053144118075450,"Right now, the only thing preventing Planned Parenthood from being defunded is a Democratic president. The health of millions of Americans is too important to gamble on a Republican.",Timeline Photos,photo,https://www.facebook.com/hillaryclinton/photos/a.889773484412515.1073741828.889307941125736/1053144118075450/?type=3,2016-01-16 17:43:01,14701,1491,1665
889307941125736_1053116498078212,“You have a right to find out what others who are doing the job you’re doing get paid.” Hillary on the Paycheck Fairness Act → hrc.io/1Zsat38,"You Asked, Hillary Clinton Answered",link,http://hrc.io/1Zsat38,2016-01-16 16:30:31,10321,879,563
889307941125736_1053076658082196,Hillary made clear this week: There is no excuse for what's happening in Flint. No parent should have to worry that the water their child is drinking is poisonous.,"What’s happening with the water in Flint, Michigan, is an outrage.",link,http://hrc.io/1PiyP9S,2016-01-16 15:25:19,13226,920,1539
889307941125736_1052959914760537,"Jimmy Fallon: Can we do a Snapchat? 

Hillary: Sure! 👻",Snapchat with Jimmy Fallon,video,https://www.facebook.com/hillaryclinton/videos/1052959914760537/,2016-01-16 12:53:02,20186,1201,2031
889307941125736_1052490558140806,"""This is incredibly personal."" Hillary speaks at the Brady Campaign to Prevent Gun Violence about doing everything we can to prevent gun violence.",,video,https://www.facebook.com/hillaryclinton/videos/1052490558140806/,2016-01-16 10:14:25,9537,906,1101
889307941125736_1052544518135410,Don’t let this become reality.,8 tweets (from the future!) that show what's really at stake if a Republican wins the White House,link,http://hrc.io/1UW43rG,2016-01-15 21:37:01,16591,3142,1291
889307941125736_1052532431469952,Text BACKSTAGE to 47246 to get behind-the-scenes updates from Hillary as she gets ready for the #DemDebate on Sunday.,Timeline Photos,photo,https://www.facebook.com/hillaryclinton/photos/a.889773484412515.1073741828.889307941125736/1052532431469952/?type=3,2016-01-15 21:00:00,9630,1205,581
889307941125736_1052531034803425,Jimmy Fallon had some important questions for Hillary.,Hillary Clinton interviews for the job of president—with Jimmy Fallon.,link,http://hrc.io/1UW1Kou,2016-01-15 20:14:06,7919,590,366
889307941125736_1052451908144671,No podemos permitir que este tipo de tragedias sigan sucediendo. Nelba perdió a su hija en la masacre de Sandy Hook.,"Durante su último Estado de la Unión, el Presidente Obama dejó una silla vacía en homenaje a...",link,https://www.hillaryclinton.com/feed/durante-su-ultimo-estado-de-la-union-el-presidente-obama-dejo-una-silla-vacia-en-homenaje-victimas-de-las-armas-de-fuego-mi-hija-fue-una-de-esas-victimas/,2016-01-15 17:34:46,2301,340,111
889307941125736_1052449464811582,"""I would like to see Planned Parenthood even get more funding."" How to ensure that all women—particularly low-income women and women of color—have equal access to health care.",Hillary Clinton: Don't Defund Planned Parenthood. Fund It More.,link,http://fusion.net/video/256092/hillary-clinton-fund-planned-parenthood/,2016-01-15 17:30:26,19448,1093,986
889307941125736_1052359914820537,Hillary and Cecile Richards sat down with Refinery29 and talked about everything from “mansplaining” to the future of abortion rights.,Republicans’ worst nightmare: Hillary Clinton and Cecile Richards talk politics and women’s rights.,link,http://hrc.io/1NbOrut,2016-01-15 14:22:43,11695,785,649
889307941125736_1052268008163061,"""I'll tell you what, Donald J. Trump's a lot more obsessed with me than I am with him.""",,video,https://www.facebook.com/hillaryclinton/videos/1052268008163061/,2016-01-15 12:01:38,40493,2071,6838
889307941125736_1052207018169160,"This time next year, a new president will walk into the Oval Office and either build on President Obama's work on climate, guns, and immigration—or rip that progress away.","A Republican president would undo President Obama's actions on guns, climate, and a whole lot more",link,http://hrc.io/1QaVrOI,2016-01-15 09:47:05,6998,1108,578
889307941125736_1051935218196340,Need a good laugh after watching #GOPDebate? Catch Hillary on The Tonight Show Starring Jimmy Fallon!,Timeline Photos,photo,https://www.facebook.com/hillaryclinton/photos/a.889773484412515.1073741828.889307941125736/1051935218196340/?type=3,2016-01-14 23:05:00,16096,1189,865
889307941125736_1051931528196709,"Want one? Thought so. The first 5,000 people to sign up will receive this free sticker. Just tell us where to send it. #GOPDebate",Free Sticker: We cannot afford a Republican in the White House,link,http://hrc.io/233o3ib,2016-01-14 22:37:36,11295,1224,800
889307941125736_1051921581531037,#GOPDebate,Timeline Photos,photo,https://www.facebook.com/hillaryclinton/photos/a.889773484412515.1073741828.889307941125736/1051921581531037/?type=3,2016-01-14 22:15:00,19820,1340,2769
889307941125736_1051881348201727,Always a great time on The Tonight Show Starring Jimmy Fallon. Thanks for snapping with us! (👻: HillaryClinton),Timeline Photos,photo,https://www.facebook.com/hillaryclinton/photos/a.889773484412515.1073741828.889307941125736/1051881348201727/?type=3,2016-01-14 20:43:16,35467,1495,1290
889307941125736_1051842408205621,Follow The Briefing on Twitter during the #GOPdebate tonight to see what 2017 might look like under a Republican president. (Spoiler: It's not pretty.) → http://hrc.io/briefing2017,,video,https://www.facebook.com/hillaryclinton/videos/1051842408205621/,2016-01-14 20:10:28,1614,526,310
889307941125736_1051829724873556,Did you know Hillary loves to dance?,5 things we learned about Hillary Clinton from her chat with YouTube stars,link,https://www.hillaryclinton.com/feed/things-we-learned-about-hillary-clinton-her-chat-youtube-stars/,2016-01-14 19:02:54,7015,727,335
889307941125736_1051798384876690,"During law school, Hillary investigated a school attempting to avoid integration in Alabama. After graduating, instead of going to a high-paying firm or taking a prestigious clerkship, she joined the Children’s Defense Fund to continue her life's work of advocating for children and families.",,video,https://www.facebook.com/hillaryclinton/videos/1051798384876690/,2016-01-14 17:59:11,15164,880,1785
889307941125736_1051722018217660,Hillary sat down with Cecile Richards and Refinery29 to discuss just what’s at stake for women's rights in the 2016 election. (Hint: A lot.),Why These 2 Women Broke A 100-Year Tradition For You,link,http://www.refinery29.com/2016/01/101149/hillary-clinton-cecile-richards-planned-parenthood-funding-interview,2016-01-14 15:43:18,5829,658,546
889307941125736_1051679121555283,Did you miss any of the GOP’s greatest hits of 2015? Watch the year’s best far-right anthems!,,video,https://www.facebook.com/hillaryclinton/videos/1051679121555283/,2016-01-14 14:45:34,8369,1117,3289
889307941125736_1051670364889492,"When it comes to reproductive rights, there’s more on the line than ever before. That’s why it’s so important to elect a candidate who has always fought for women—and always will.",,video,https://www.facebook.com/hillaryclinton/videos/1051670364889492/,2016-01-14 14:33:52,3339,370,962
889307941125736_1051658454890683,,Hillary for Nevada,photo,https://www.facebook.com/HillaryforNV/photos/a.774233416027067.1073741828.771631249620617/933084193475321/?type=3,2016-01-14 13:54:33,256,237,0
889307941125736_1051611671562028,,Hillary for South Carolina,link,http://www.cnn.com/2016/01/13/politics/hillary-clinton-eric-holder-endorsement/,2016-01-14 12:27:52,322,305,0
889307941125736_1051541098235752,,Hillary for New Hampshire,photo,https://www.facebook.com/HillaryforNH/photos/a.632914340186841.1073741828.630309247114017/754562938021980/?type=3,2016-01-14 09:59:22,610,523,0
889307941125736_1051307851592410,,Hillary for Iowa,photo,https://www.facebook.com/HillaryforIA/photos/a.913771128661626.1073741828.911083522263720/1055993571106047/?type=3,2016-01-13 22:33:32,297,657,0
889307941125736_1051269611596234,"""From the time I met her 45 years ago this March, she's the best changemaker I've ever known."" -President Bill Clinton",Timeline Photos,photo,https://www.facebook.com/hillaryclinton/photos/a.889773484412515.1073741828.889307941125736/1051269611596234/?type=3,2016-01-13 21:30:44,21019,1450,1186
889307941125736_1051198138270048,,Hillary for New Hampshire,photo,https://www.facebook.com/HillaryforNH/photos/a.632914340186841.1073741828.630309247114017/754312021380405/?type=3,2016-01-13 18:28:28,696,584,0
889307941125736_1051150994941429,"On the trail in New Hampshire, world champion Abby Wambach led us in a chant she knows well—with a new twist.",media.giphy.com,link,https://media.giphy.com/media/l3nWiW8S5Ridm5qgw/giphy.gif,2016-01-13 16:45:10,9468,1010,602
889307941125736_1051137898276072,,Hillary for South Carolina,photo,https://www.facebook.com/HillaryforSC/photos/a.1378356572492928.1073741828.1376680222660563/1530192183976032/?type=3,2016-01-13 16:17:16,248,293,0
889307941125736_1051092494947279,Don’t let this happen.,What would a State of the Union be like under a Republican president? Here’s a disturbing preview.,link,http://hrc.io/1PbSpVb,2016-01-13 14:35:12,4403,728,284
889307941125736_1050950584961470,"President Obama, by the numbers: 18 million Americans insured, 14 million new jobs, and 27 executive actions to stop gun violence.",14 numbers that show how far we’ve come under President Obama,link,http://hrc.io/1W7stQb,2016-01-13 10:04:40,24485,1334,1706
889307941125736_1050592708330591,"From a stronger economy to affordable health care to commonsense gun measures, we’ve accomplished so much under President Obama’s leadership. We need to build on that progress—not go backwards. #SOTU",Timeline Photos,photo,https://www.facebook.com/hillaryclinton/photos/a.889773484412515.1073741828.889307941125736/1050592708330591/?type=3,2016-01-12 22:09:46,207554,8458,31025
889307941125736_1050597494996779,It’s time to pick a side. Either we stand with the gun lobby or we join President Obama and stand up to them. http://hrc.io/1ZrA69q,,video,https://www.facebook.com/hillaryclinton/videos/1050597494996779/,2016-01-12 21:49:34,13837,1811,3013
889307941125736_1050587954997733,America is better because of President Obama's leadership. Proud to call him my friend. Let’s build on his progress. -H #SOTU,Timeline Photos,photo,https://www.facebook.com/hillaryclinton/photos/a.889773484412515.1073741828.889307941125736/1050587954997733/?type=3,2016-01-12 21:06:02,100840,2666,5478
889307941125736_1050575751665620,"“We should do all we can to protect American families—in every community—from these losses.” —Nelba Márquez-Greene, mom of one of the victims at Sandy Hook.",An open seat at the State of the Union will honor gun violence victims—including my 6-year-old.,link,http://hrc.io/1nh5giP,2016-01-12 20:40:04,5903,404,338
889307941125736_1050531761670019,You can sue a toy company for making an unsafe teddy bear—but you can’t sue a company that manufactured an assault rifle used to kill a classroom of children. Here’s how that happened.,How Congress gave the gun industry immunity from lawsuits,link,http://hrc.io/1J1IdlT,2016-01-12 20:01:01,9492,971,1432
889307941125736_1050512498338612,"“As a woman seeking the presidency, as I am, you have to be aware of how people will judge you for being emotional. It’s a really delicate balancing act.” Don’t miss Hillary on The Conversation tomorrow at 10 PM ET/9 PM CT on Lifetime.",,video,https://www.facebook.com/hillaryclinton/videos/1050512498338612/,2016-01-12 19:07:50,2998,670,559
889307941125736_1050522178337644,,Hillary for South Carolina,photo,https://www.facebook.com/HillaryforSC/photos/a.1529816087346975.1073741838.1376680222660563/1529816107346973/?type=3,2016-01-12 19:03:01,215,143,0
889307941125736_1050511605005368,"“Republicans in Congress and on the campaign trail talk about [immigrants] as if we don’t have families, as if we don’t laugh, cry, and love like any other person. They’re wrong.”","For the first time in 16 years, my mother got to leave the country and see her sick father.",link,https://medium.com/hillary-for-america/for-the-first-time-in-16-years-my-mother-got-to-leave-the-country-and-see-her-sick-father-2c6fd0d60d17#.f15npo1wg,2016-01-12 18:38:48,3747,244,148
889307941125736_1050496121673583,The New Hampshire primary is coming up! Follow Hillary for New Hampshire to stay updated as Hillary (and Chelsea Clinton) visit the Granite State.,Hillary for New Hampshire,link,https://www.facebook.com/HillaryforNH/,2016-01-12 18:04:30,229,277,0
889307941125736_1050443995012129,"A year from now, a new president will walk into the Oval Office. We can't afford to let it be a Republican.",Timeline Photos,photo,https://www.facebook.com/hillaryclinton/photos/a.889773484412515.1073741828.889307941125736/1050443995012129/?type=3,2016-01-12 17:03:29,8400,969,1352
889307941125736_1050434721679723,,Hillary for Iowa,photo,https://www.facebook.com/HillaryforIA/photos/a.913771128661626.1073741828.911083522263720/1055350964503641/?type=3,2016-01-12 16:47:01,888,336,0
889307941125736_1050407988349063,No government should tell a woman what she can do with her body.,This is what it looks like when a presidential candidate truly understands reproductive rights.,link,http://hrc.io/1RALuM6,2016-01-12 15:55:11,10528,567,637
889307941125736_1050371225019406,"Scandal's President Grant—aka Tony Goldwyn—joined in, too.","Hillary Clinton and Ellen teamed up for a game of charades, and it was hilarious.",link,http://hrc.io/1KbISwa,2016-01-12 14:46:50,3100,190,109
889307941125736_1050350025021526,We need to acknowledge the systemic racism in our country and work together to deliver real reform.,,video,https://www.facebook.com/hillaryclinton/videos/1050350025021526/,2016-01-12 14:29:45,9879,452,1364
889307941125736_1050305311692664,"Why did Planned Parenthood Action endorse Hillary Clinton? ""With so much at stake in this election, we need someone who will do more than just defend reproductive rights—we need a steadfast champion who will fight to expand them, and do so not just when it’s easy, but also when it’s hard.""",How Do Hillary Clinton and Bernie Sanders Compare on Women’s Health?,link,http://hrc.io/1JIi9fG,2016-01-12 12:48:12,7447,720,695
