status_id,status_message,link_name,status_type,status_link,status_published,num_likes,num_comments,num_shares
889307941125736_963632270359969,Hillary has been a champion for everyday families her whole life. That's why she's running for president.,Timeline Photos,photo,https://www.facebook.com/hillaryclinton/photos/a.889773484412515.1073741828.889307941125736/963632270359969/?type=3,2015-08-17 07:44:54,406,266,66
889307941125736_963441403712389,Time to step up your selfie game—you could meet Hillary on Tuesday. Enter for your chance now.,Meet Hillary in Las Vegas!,link,http://hrc.io/1Nzffae,2015-08-16 20:45:30,276,418,54
889307941125736_963317300391466,Warming up for Team Hillary: Jason Collins visits campaign HQ.,,video,https://www.facebook.com/hillaryclinton/videos/963317300391466/,2015-08-16 15:12:33,2919,631,223
889307941125736_963236440399552,"Take this quiz to see how Hillary's plan will help you afford college if you're going, or manage student debt if you've already gone: http://hrc.io/1IU2SEL",Timeline Photos,photo,https://www.facebook.com/hillaryclinton/photos/a.889773484412515.1073741828.889307941125736/963236440399552/?type=3,2015-08-16 11:53:04,1424,610,146
889307941125736_962834507106412,Hillary has been a champion for everyday families her whole life. That's why she's running for president.,Timeline Photos,photo,https://www.facebook.com/hillaryclinton/photos/a.889773484412515.1073741828.889307941125736/962834507106412/?type=3,2015-08-16 09:00:02,572,543,128
889307941125736_962834170439779,Hillary has been a champion for everyday families her whole life. That's why she's running for president.,Timeline Photos,photo,https://www.facebook.com/hillaryclinton/photos/a.889773484412515.1073741828.889307941125736/962834170439779/?type=3,2015-08-16 08:00:00,296,261,52
889307941125736_962662423790287,Doing the Iowa State Fair the right way. 🍖,Timeline Photos,photo,https://www.facebook.com/hillaryclinton/photos/a.889773484412515.1073741828.889307941125736/962662423790287/?type=3,2015-08-15 19:41:56,22983,1629,974
889307941125736_962581843798345,"""I don’t care how many super PACs and Republicans pile on. I’ve been fighting for families and underdogs my entire life and I’m not going to stop now.""—Hillary in Clear Lake, Iowa",Timeline Photos,photo,https://www.facebook.com/hillaryclinton/photos/a.889773484412515.1073741828.889307941125736/962581843798345/?type=3,2015-08-15 16:06:44,13113,1421,1151
889307941125736_962505920472604,“We need to make a quality education affordable and available to everyone willing to work for it — without saddling them with decades of debt.” Read Hillary’s plan to help Americans relieve the burden of student debt and make college affordable.,The New College Compact,link,http://hrc.io/college,2015-08-15 12:58:05,1791,516,209
889307941125736_962453293811200,Why does Hillary love Snapchat? Watch and learn:,Hillary Loves Snapchat,video,https://www.facebook.com/hillaryclinton/videos/962453293811200/,2015-08-15 11:05:25,7645,1254,1995
889307941125736_962455243811005,Hillary has been a champion for everyday families her whole life. That's why she's running for president.,Timeline Photos,photo,https://www.facebook.com/hillaryclinton/photos/a.889773484412515.1073741828.889307941125736/962455243811005/?type=3,2015-08-15 11:04:08,342,213,65
889307941125736_962455000477696,Hillary has been a champion for everyday families her whole life. That's why she's running for president.,Timeline Photos,photo,https://www.facebook.com/hillaryclinton/photos/a.889773484412515.1073741828.889307941125736/962455000477696/?type=3,2015-08-15 11:02:18,469,243,62
889307941125736_961889437200919,"What Donald Trump said about Megyn Kelly after the first Republican debate was offensive, and it deserves the kind of reaction that it's getting from so many others—but if we focus on that, we're making a mistake. What a lot of the men on that stage in the debate said was offensive: some very radical and offensive positions when it comes to women's lives, women's reproductive health, women's opportunities. 
 
When one of the GOP’s major candidates, Marco Rubio, says there should be no exceptions for rape and incest in a ban on abortion, that is as offensive and as troubling a comment as you can hear from a major candidate running for the presidency. The language may be more colorful and more offensive when it comes from one candidate, but the thinking, and the attitude, toward women is very much the same as the rest—it's just delivered in a different package. What they say about women should not be forgotten. 

So yes, it makes great TV. Trump went way overboard: offensive, outrageous, pick your adjective. But what Rubio said has as much of an impact in terms of where the Republican party is today as anybody else on that stage. And it is deeply troubling, and it should be to the press, not just to those who fight for women’s health and rights.",,status,,2015-08-14 12:15:51,21118,2703,2184
889307941125736_961826253873904,"“Hillary’s plan to make college affordable wouldn’t have just helped me—it would have helped my mom. And she deserved it. She’s one of the best people I know."" Learn more about how Hillary’s plan will help every American afford college and pay off student debt: hrc.io/college",Hillary for Iowa,photo,https://www.facebook.com/HillaryforIA/photos/a.913771128661626.1073741828.911083522263720/980574831981255/?type=3,2015-08-14 10:05:50,3041,572,0
889307941125736_961764217213441,Hillary has been a champion for everyday families her whole life. That's why she's running for president.,Timeline Photos,photo,https://www.facebook.com/hillaryclinton/photos/a.889773484412515.1073741828.889307941125736/961764217213441/?type=3,2015-08-14 08:01:00,575,581,124
889307941125736_961751253881404,Today is Social Security's 80th birthday. Congrats on reaching what some Republicans think should be the retirement age. –H,,status,,2015-08-14 07:13:05,10725,748,927
889307941125736_961491523907377,We should make voting easier—not harder. Why is voting important to you? Read stories from Americans across the country and share your own: myfirstvote.tumblr.com,Timeline Photos,photo,https://www.facebook.com/hillaryclinton/photos/a.889773484412515.1073741828.889307941125736/961491523907377/?type=3,2015-08-13 18:12:09,3791,831,507
889307941125736_961432343913295,This was emailed to us with the subject line 'MESSAGE FROM THE TOP OF MT. DEMOCRAT':,Timeline Photos,photo,https://www.facebook.com/hillaryclinton/photos/a.889773484412515.1073741828.889307941125736/961432343913295/?type=3,2015-08-13 15:32:51,12104,1101,850
889307941125736_961347427255120,Team meeting.,Timeline Photos,photo,https://www.facebook.com/hillaryclinton/photos/a.889773484412515.1073741828.889307941125736/961347427255120/?type=3,2015-08-13 11:57:02,8799,1081,403
889307941125736_961026623953867,Take our new quiz! How will Hillary’s plan help you afford college and pay off student loans? Find out: http://hrc.io/collegequiz,QUIZ: The New College Compact,link,http://hrc.io/collegequiz,2015-08-13 09:02:25,1611,568,165
889307941125736_960842433972286,Hillary has been a champion for everyday families her whole life. That's why she's running for president.,Timeline Photos,photo,https://www.facebook.com/hillaryclinton/photos/a.889773484412515.1073741828.889307941125736/960842433972286/?type=3,2015-08-13 08:01:37,446,504,83
889307941125736_960841557305707,Hillary has been a champion for everyday families her whole life. That's why she's running for president.,Timeline Photos,photo,https://www.facebook.com/hillaryclinton/photos/a.889773484412515.1073741828.889307941125736/960841557305707/?type=3,2015-08-13 08:00:33,177,178,20
889307941125736_960642170658979,"Step 1: Vote for your favorite design to become the next #Hillary2016 bumper sticker → http://hrc.io/1NbAyRm
Step 2: Grab the winner!",Timeline Photos,photo,https://www.facebook.com/hillaryclinton/photos/a.889773484412515.1073741828.889307941125736/960642170658979/?type=3,2015-08-12 21:25:54,1750,699,135
889307941125736_960468157343047,"Answer in the comments!

Under Hillary's college plan, every borrower can enroll in a program where they never have to pay more than 10 percent of their income per month to pay down their loans, with college debt forgiven after 20 years or 10 years for graduates that pursue careers in national service.",Timeline Photos,photo,https://www.facebook.com/hillaryclinton/photos/a.889773484412515.1073741828.889307941125736/960468157343047/?type=3,2015-08-12 14:52:44,1595,1237,126
889307941125736_960436104012919,"Women represent only 24% of the workforce in science, technology, engineering, and math fields, but earn 33% more on average. Unlocking the potential of young women is critical to our nation’s success—and we can all play our part in doing it.",Timeline Photos,photo,https://www.facebook.com/hillaryclinton/photos/a.889773484412515.1073741828.889307941125736/960436104012919/?type=3,2015-08-12 13:33:18,5653,662,743
889307941125736_960375607352302,"“We do have to speak out about it, and we do have to try to get more people to take it seriously, because it’s hurtful.” Watch Hillary on cyberbullying:",,video,https://www.facebook.com/hillaryclinton/videos/960375607352302/,2015-08-12 11:22:56,4783,855,631
889307941125736_960327300690466,Hillary has been a champion for everyday families her whole life. That's why she's running for president.,Timeline Photos,photo,https://www.facebook.com/hillaryclinton/photos/a.889773484412515.1073741828.889307941125736/960327300690466/?type=3,2015-08-12 10:01:36,364,335,136
889307941125736_960272897362573,Hillary has been a champion for everyday families her whole life. That's why she's running for president.,Timeline Photos,photo,https://www.facebook.com/hillaryclinton/photos/a.889773484412515.1073741828.889307941125736/960272897362573/?type=3,2015-08-12 09:06:10,411,379,101
889307941125736_959762404080289,What do you think should be the next #Hillary2016 bumper sticker? Vote for your favorite: http://hrc.io/1hwDADK,Vote for your favorite sticker!,link,http://hrc.io/1hwDADK,2015-08-11 20:40:03,1525,879,118
889307941125736_959680600755136,Scott Walker and other Republicans are making it more difficult for Americans to afford college or pay off their student debt. Hillary says that’s wrong—watch:,,video,https://www.facebook.com/hillaryclinton/videos/959680600755136/,2015-08-11 18:38:08,8076,1150,1227
889307941125736_959605440762652,"“I want every young person in America to know that if you work hard, you can get ahead, and I want America to have your back, just like it did in the past.”—Hillary in NH",Timeline Photos,photo,https://www.facebook.com/hillaryclinton/photos/a.889773484412515.1073741828.889307941125736/959605440762652/?type=3,2015-08-11 15:02:20,13541,1374,1102
889307941125736_959482240774972,"With Hillary’s plan to make higher education accessible and affordable, every student in America will be able to attend a public college.",The New College Compact,link,https://medium.com/@HillaryClinton/the-new-college-compact-73652df9543c,2015-08-11 12:56:28,3019,439,362
889307941125736_959350490788147,"Affordable, accessible higher education means low interest rates and repayment based on income. If you're one of the 40 million Americans with student debt, learn more here: http://hrc.io/college",Timeline Photos,photo,https://www.facebook.com/hillaryclinton/photos/a.889773484412515.1073741828.889307941125736/959350490788147/?type=3,2015-08-11 10:02:41,3695,457,524
889307941125736_959253854131144,Hillary has been a champion for everyday families her whole life. That's why she's running for president.,Timeline Photos,photo,https://www.facebook.com/hillaryclinton/photos/a.889773484412515.1073741828.889307941125736/959253854131144/?type=3,2015-08-11 09:00:01,368,264,89
889307941125736_959244607465402,Hillary has been a champion for everyday families her whole life. That's why she's running for president.,Timeline Photos,photo,https://www.facebook.com/hillaryclinton/photos/a.889773484412515.1073741828.889307941125736/959244607465402/?type=3,2015-08-11 08:01:50,431,284,88
889307941125736_958985540824642,#Hillary2016 is on Snapchat! Add us: @HillaryClinton,Timeline Photos,photo,https://www.facebook.com/hillaryclinton/photos/a.889773484412515.1073741828.889307941125736/958985540824642/?type=3,2015-08-10 20:12:37,2375,405,103
889307941125736_958954274161102,Agree that every student in America should be able to attend a public university without taking out a loan to pay tuition? Add your name: http://hrc.io/collegecompact,Stand with Hillary and the New College Compact,link,http://hrc.io/1Mgdgcm,2015-08-10 18:45:46,3490,572,345
889307941125736_958930887496774,What Donald Trump said about Megyn Kelly is outrageous—but what's really outrageous is Republicans' actual positions on issues that affect women.,,status,,2015-08-10 17:44:54,15128,1055,846
889307941125736_958910914165438,Hillary llegó a Snapchat. ¡Síganos en @hillaryclinton!,Timeline Photos,photo,https://www.facebook.com/hillaryclinton/photos/a.889773484412515.1073741828.889307941125736/958910914165438/?type=3,2015-08-10 16:45:22,760,134,34
889307941125736_958759144180615,"An education shouldn’t be something just for those at the top, and it shouldn’t be a burden. An education should be affordable — and available — to everyone. Read Hillary’s plan: http://hrc.io/college",The New College Compact,link,http://hrc.io/college,2015-08-10 13:24:13,4282,611,721
889307941125736_958610637528799,Let’s make college affordable. Let’s lift the crushing burden of student debt. Let’s help every young person and family reach their full potential. Watch our new video:,The New College Compact,video,https://www.facebook.com/hillaryclinton/videos/958610637528799/,2015-08-10 08:13:32,4570,1135,1200
889307941125736_958400594216470,Add us on Snapchat! @hillaryclinton 👻,Mobile Uploads,photo,https://www.facebook.com/hillaryclinton/photos/a.889700951086435.1073741826.889307941125736/958400594216470/?type=3,2015-08-09 20:04:11,3282,419,171
889307941125736_958318430891353,From Beijing to Brooklyn (with plenty of stops in between)—follow some of Hillary's memorable moments: hrc.io/moments,Memorable Moments,link,http://hrc.io/moments,2015-08-09 16:48:12,6129,497,279
889307941125736_958193787570484,"50 years since the Voting Rights Act became law, we have to make voting easier for every American—not harder. Why is voting important to you? Share your story here: myfirstvote.tumblr.com",Timeline Photos,photo,https://www.facebook.com/hillaryclinton/photos/a.889773484412515.1073741828.889307941125736/958193787570484/?type=3,2015-08-09 11:30:41,3203,482,299
889307941125736_958104777579385,Join Hillary's fight to build an America where we don't leave anyone out or anyone behind: http://hrc.io/1EhAs3k,Timeline Photos,photo,https://www.facebook.com/hillaryclinton/photos/a.889773484412515.1073741828.889307941125736/958104777579385/?type=3,2015-08-09 09:18:13,6132,633,954
889307941125736_957866547603208,Hillary's pinning her way across America! Follow her on the campaign trail: hrc.io/trail,From the Trail,link,http://hrc.io/trail,2015-08-08 20:05:12,4761,503,244
889307941125736_957662950956901,How to say “Go Hillary!” in Spanish. Cómo decir “Go Hillary!” en español.,Timeline Photos,photo,https://www.facebook.com/hillaryclinton/photos/a.889773484412515.1073741828.889307941125736/957662950956901/?type=3,2015-08-08 13:10:14,11761,1381,1447
889307941125736_957482054308324,"For Jan, voting means showing her daughters that ""they can change the world."" Read more #MyFirstVote stories in honor of the 50th anniversary of the Voting Rights Act, and share your own: myfirstvote.tumblr.com",Timeline Photos,photo,https://www.facebook.com/hillaryclinton/photos/a.889773484412515.1073741828.889307941125736/957482054308324/?type=3,2015-08-08 08:37:13,6074,561,658
889307941125736_957176717672191,Hillary's fighting for immigration reform that keeps families together. Read more from Hillary's Facebook Q&A: hrc.io/QandA,Timeline Photos,photo,https://www.facebook.com/hillaryclinton/photos/a.889773484412515.1073741828.889307941125736/957176717672191/?type=3,2015-08-07 19:13:11,8510,844,816
889307941125736_957045887685274,"If you're willing to work hard and do your part, you ought to be able to get ahead and stay ahead. There are a lot of factors working against that right now, and I'm going to stand and fight against them.",,status,,2015-08-07 16:42:19,7889,752,383
889307941125736_956957751027421,America's strength lies in families and communities. Sign up to support Hillary's plan for a fairness and growth economy: http://hrc.io/1PbgVrC,Timeline Photos,photo,https://www.facebook.com/hillaryclinton/photos/a.889773484412515.1073741828.889307941125736/956957751027421/?type=3,2015-08-07 12:54:17,6156,775,866
889307941125736_956838967705966,"""Everything is going to change now."" Read more #MyFirstVote stories on Tumblr, and share your own: myfirstvote.tumblr.com",Timeline Photos,photo,https://www.facebook.com/hillaryclinton/photos/a.889773484412515.1073741828.889307941125736/956838967705966/?type=3,2015-08-07 08:25:23,4834,612,261
889307941125736_956636144392915,Prouder than ever to be on Team Hillary? Share this.,Timeline Photos,photo,https://www.facebook.com/hillaryclinton/photos/a.889773484412515.1073741828.889307941125736/956636144392915/?type=3,2015-08-06 22:20:20,10721,856,1829
889307941125736_956628257727037,Watch the GOP debate? Bet you feel like donating to a Democrat right about now. hrc.io/1hmsalS,Support Hillary for America,link,http://hrc.io/1hmsalS,2015-08-06 22:06:27,14926,1272,1103
889307941125736_956618057728057,Inspiration on the walls of HQ during the debate tonight.,Timeline Photos,photo,https://www.facebook.com/hillaryclinton/photos/a.889773484412515.1073741828.889307941125736/956618057728057/?type=3,2015-08-06 21:46:45,23428,764,2414
889307941125736_956616767728186,"If GOP attacks on Planned Parenthood feel like an assault on women's health, it's because they are. Fight back: http://hrc.io/1IRp97f",Join Hillary and Stand with Planned Parenthood,link,http://hrc.io/1IRp97f,2015-08-06 21:39:44,9616,552,639
889307941125736_956586494397880,It’s time to fix our broken immigration system once and for all.,Stand with Hillary on Immigration Reform,link,http://hrc.io/1SV8C9d,2015-08-06 20:25:02,6258,419,382
889307941125736_956578034398726,"Get Team Hillary's take on tonight's Republican debate by following The Briefing—look for fact checks of the candidates, debate analysis, and more.",Timeline Photos,photo,https://www.facebook.com/hillaryclinton/photos/a.889773484412515.1073741828.889307941125736/956578034398726/?type=3,2015-08-06 20:00:58,5913,728,1067
889307941125736_956490107740852,"Defund Planned Parenthood. 
Overturn Roe v. Wade. 
""Find a husband."" 

The GOP on women. (Yep, really.)",The Briefing,video,https://www.facebook.com/TheBriefing2016/videos/447748372080184/,2015-08-06 16:48:20,7389,755,5
889307941125736_956465874409942,"“When the Constitution was first written, it left most of us here out. But generations of Americans fought and marched and organized and prayed to expand the circle of freedom and opportunity. They never gave up and never backed down ...That is the story of progress: courageous men and women expanding rights, not restricting them. And today we refuse, we refuse to allow our country or this generation of leaders to slow or reverse America’s long march toward a more perfect union.”—Hillary",,status,,2015-08-06 15:41:00,8629,459,822
889307941125736_956427504413779,"Add your name if you agree with Hillary: We should make it easier, not harder, for every American citizen to exercise their right to vote → hrc.io/votingrights",Timeline Photos,photo,https://www.facebook.com/hillaryclinton/photos/a.889773484412515.1073741828.889307941125736/956427504413779/?type=3,2015-08-06 14:05:20,3992,499,2000
889307941125736_956371854419344,"Fifty years since the Voting Rights Act became law, we still have much more work to do to protect the right to vote.",50th Anniversary of the Voting Rights Act,video,https://www.facebook.com/hillaryclinton/videos/956371854419344/,2015-08-06 11:42:03,4310,435,926
889307941125736_956332431089953,"Today marks the 50th Anniversary of the Voting Rights Act, signed in 1965 to make sure every American could exercise their right to vote. Read these #MyFirstVote stories from Americans across the country: myfirstvote.tumblr.com",Timeline Photos,photo,https://www.facebook.com/hillaryclinton/photos/a.889773484412515.1073741828.889307941125736/956332431089953/?type=3,2015-08-06 10:34:40,3301,399,235
889307941125736_956028281120368,Lucharé por una reforma migratoria integral con un camino hacia la ciudadanía plena y equitativa. No hay lugar en Estados Unidos para una ciudadanía de segunda clase.,,video,https://www.facebook.com/hillaryclinton/videos/956028281120368/,2015-08-05 20:01:38,4176,587,748
889307941125736_955988777790985,"Tomorrow is the 50th Anniversary of the Voting Rights Act. President Johnson signed the VRA's voting protections into law in 1965—and today, it's under attack. Share why the right to vote is important to you in the comments below.",,status,,2015-08-05 18:27:00,3331,532,202
889307941125736_955944687795394,"“I'm tired of women being shamed and blamed and dismissed… When you attack Planned Parenthood, you attack women's health. And when you attack women's health, you attack America's health.”—Hillary yesterday",,status,,2015-08-05 16:51:14,40625,1892,2487
889307941125736_955852284471301,To Jeb Bush and Republicans who don't think women's health should be a priority: You couldn't be more wrong.,The Briefing,video,https://www.facebook.com/TheBriefing2016/videos/447534382101583/,2015-08-05 13:39:35,10811,1034,0
889307941125736_955783551144841,"No parent should have to choose between getting a paycheck and caring for their baby. Well done, Netflix.",Starting Now at Netflix: Unlimited Maternity and Paternity Leave,link,http://blog.netflix.com/2015/08/starting-now-at-netflix-unlimited.html,2015-08-05 10:57:48,19001,574,1522
889307941125736_955740921149104,"""We’ve had a lot of grandfathers in the White House, but we haven’t had a grandmother."" Watch Hillary's Chair Chat with South Carolina Democratic Party's Jaime Harrison.",Chair Chats,link,http://scdp.org/chairs-chats/,2015-08-05 09:01:18,4041,521,234
889307941125736_955463984510131,"The Voting Rights Act turns 50 on Thursday. Signed by President Johnson in 1965, the VRA helped make sure every American could exercise their right to vote. Celebrate by sharing what the right to vote means to you in the comments below.",,status,,2015-08-04 19:21:56,438,351,33
889307941125736_955463721176824,"The Voting Rights Act turns 50 on Thursday. Signed by President Johnson in 1965, the VRA helped make sure every American could exercise their right to vote. Celebrate by sharing what it felt like to cast your first ballot—add your thoughts in the comments below.",,status,,2015-08-04 19:20:55,1026,197,56
889307941125736_955463297843533,"Help celebrate the 50th anniversary of the Voting Rights Act, signed in 1965 to help make sure every American could exercise their right to vote. What would you tell young Americans about why it's important to vote? Leave some words of wisdom in the comments below.",,status,,2015-08-04 19:19:31,2971,470,160
889307941125736_955392481183948,"Jeb Bush is absolutely, unequivocally wrong.",Timeline Photos,photo,https://www.facebook.com/hillaryclinton/photos/a.889773484412515.1073741828.889307941125736/955392481183948/?type=3,2015-08-04 16:23:18,12642,1194,1092
889307941125736_955265201196676,"The evidence is overwhelming: If we want a competitive future for our kids, they have to be better prepared when they walk into kindergarten. There is no doubt that good quality early childhood programs and prekindergarten would make that happen.",,status,,2015-08-04 11:17:16,8124,820,510
889307941125736_955209414535588,Hillary has spent her entire life standing up for kids and families. That's why she's running for president. Watch one of our first TV ads of the 2016 campaign:,Family Strong,video,https://www.facebook.com/hillaryclinton/videos/955209414535588/,2015-08-04 09:18:42,9107,938,1853
889307941125736_954950777894785,"Mirando hacía el futuro y demostrando su compromiso de colaborar con las Américas, Hillary pidió el levantamiento del embargo a Cuba. Vean los mejores momentos del discurso y compartanlos por WhatsApp: http://hrc.io/1MIHeXL",Hillary's vision for a new future with Cuba,link,http://hrc.io/1MIHeXL,2015-08-03 20:31:36,1456,402,93
889307941125736_954865077903355,"Hillary stands with Planned Parenthood. Add your name if you do, too: http://hrc.io/1Do9Brk",Join Hillary and Stand with Planned Parenthood,link,http://hrc.io/1Do9Brk,2015-08-03 17:05:12,5604,794,326
889307941125736_954843854572144,"2.7 million Americans turn to Planned Parenthood every year for health care. If politicians really wanted to do some good for this country, they would stop taking aim at Planned Parenthood and start standing with them.",Timeline Photos,photo,https://www.facebook.com/hillaryclinton/photos/a.889773484412515.1073741828.889307941125736/954843854572144/?type=3,2015-08-03 16:14:05,40106,1808,6260
889307941125736_954772411245955,Hillary has a message for the politicians attacking women's health and trying to cut off millions of Americans from lifesaving health care at Planned Parenthood—and Republicans should take note:,Stand with Planned Parenthood,video,https://www.facebook.com/hillaryclinton/videos/954772411245955/,2015-08-03 13:21:37,8568,952,4971
