status_id,status_message,link_name,status_type,status_link,status_published,num_likes,num_comments,num_shares
889307941125736_1013132372076625,"If you're proud to be a Democrat after watching tonight's Republican debate, add your name here: hrc.io/1L9yvI6",Proud To Be a Democrat,link,http://hrc.io/1L9yvI6,2015-11-10 23:23:45,11786,1637,795
889307941125736_1013098128746716,"President Obama doesn't get the credit he deserves for strengthening our economy. We need to build on that progress, not go backwards. #GOPDebate",,status,,2015-11-10 22:00:40,27256,1050,1005
889307941125736_1013086488747880,"It's hard to declare anyone a ""winner"" in the #GOPDebate when every candidate is trying to move our country backward.",The 4 biggest winners from the Republican presidential debate,link,http://hrc.io/1HwubHZ,2015-11-10 21:28:10,6230,580,393
889307941125736_1013034352086427,"Hillary’s dad Hugh, a Chief Petty Officer in the Navy during World War II, prepared thousands of sailors as they headed off to fight. After he died, she began receiving letters and photographs from the men he trained.",Hugh,video,https://www.facebook.com/hillaryclinton/videos/1013034352086427/,2015-11-10 18:53:58,7473,541,854
889307941125736_1013009698755559,"“I was surprised by how warm and personable Hillary was. She wasn’t talking about what other people were doing wrong—she talked about what's important to her, what's important to us, and what she's going to do.'” —Onica in Iowa",Hillary for Iowa,photo,https://www.facebook.com/HillaryforIA/photos/a.913771128661626.1073741828.911083522263720/1023626457676092/?type=3,2015-11-10 17:48:41,3359,298,0
889307941125736_1012987625424433,"Little girls can be anything—including champion fighters. Keep roaring, Jesse Jane!",Watch This 9-Year-Old Girl Sword Fight Like A Boss,link,http://hrc.io/1MmN3G4,2015-11-10 17:06:13,3617,163,209
889307941125736_1012932795429916,"Hillary’s veterans plan will “ensure access to timely, high quality health care and modernize veterans’ benefits.”","Clinton to unveil comprehensive plan to improve services for veterans, active military",link,http://hrc.io/1GVyzjO,2015-11-10 14:47:57,7991,612,588
889307941125736_1012864322103430,"Signed. Sealed. Delivered. 📬 Yesterday, Hillary officially declared her candidacy for the New Hampshire primary.",Timeline Photos,photo,https://www.facebook.com/hillaryclinton/photos/a.889773484412515.1073741828.889307941125736/1012864322103430/?type=3,2015-11-10 12:17:01,11917,623,512
889307941125736_1012564012133461,"At Mikey Likes It Ice Cream shop, every scoop comes with a side of community service.",This ice cream shop named a sundae after Hillary Clinton. But that's only part of the story.,link,http://hrc.io/1QqtPEI,2015-11-09 21:33:00,902,331,87
889307941125736_1012548765468319,“The future that scientists have warned us about has arrived.” —Hillary to the League of Conservation Voters,,video,https://www.facebook.com/hillaryclinton/videos/1012548765468319/,2015-11-09 20:17:06,5921,566,648
889307941125736_1012536532136209,"“When things get tough, Hillary does not back down.” —Congressman John Lewis",Why John Lewis is supporting Hillary Clinton for president,link,http://hrc.io/1lhkC5M,2015-11-09 19:10:54,9493,593,657
889307941125736_1012433348813194,"""Why are you running for president?""

""Because I want to help little kids.""","""Why are you running for president?""",video,https://www.facebook.com/hillaryclinton/videos/1012433348813194/,2015-11-09 15:09:22,12629,1018,1409
889307941125736_1012384082151454,"“When it comes to fighting the climate crisis, the stakes couldn’t be higher.” Thank you for your endorsement, League of Conservation Voters.",Timeline Photos,photo,https://www.facebook.com/hillaryclinton/photos/a.889773484412515.1073741828.889307941125736/1012384082151454/?type=3,2015-11-09 12:50:57,9251,703,1148
889307941125736_1012304692159393,"When women lose out, our economy loses out, too.",Equal pay for women isn’t just fair—it’s a game changer for the economy. Here’s why.,link,http://hrc.io/1GSQTda,2015-11-09 09:34:43,7235,593,658
889307941125736_1012091945514001,"One year from today, will America vote for the middle class, affordable health care, and women’s rights?","What's at stake in the next election, in one terrifying flow chart",link,http://hrc.io/1MRbYav,2015-11-08 21:26:09,7012,961,542
889307941125736_1012012125521983,What would it mean to have a former secretary of state in the White House? This.,Hillary Clinton was asked an unexpected foreign policy question on the trail—and she nailed it.,link,http://hrc.io/20FeEMl,2015-11-08 20:00:01,6304,641,530
889307941125736_1011997835523412,"20 billion in federal aid, 112 countries, 1 Grammy award. We quantified Hillary’s career—take a look at the numbers.",By the numbers,video,https://www.facebook.com/hillaryclinton/videos/1011997835523412/,2015-11-08 18:30:00,5547,567,908
889307941125736_1011986938857835,“This has to end.” Hillary on gun violence at the First in the South Democratic Candidates Forum.,"Hillary on gun violence: ""This has to end.""",video,https://www.facebook.com/hillaryclinton/videos/1011986938857835/,2015-11-08 17:14:34,7614,641,969
889307941125736_1011821582207704,"“We need policies that will help overcome the enduring impacts of racism. ... I have proposed making universal, high-quality preschool a reality. Low-income African American and Latino children gain the most from high-quality preschool programs—helping close the achievement gap. As president, I will fight to give every child in America the fair start they deserve.” Hillary to Ebony—read more: hrc.io/1NhOuW9",,status,,2015-11-08 13:45:00,4595,597,305
889307941125736_1011816298874899,“I know we can restore the American dream and promise. And that's what gets me up every morning and gets me around this country talking to folks and listening and trying to figure out what more I can do to make sure that comes true.” —Hillary in Iowa,Timeline Photos,photo,https://www.facebook.com/hillaryclinton/photos/a.889773484412515.1073741828.889307941125736/1011816298874899/?type=3,2015-11-08 11:45:00,9227,743,584
889307941125736_1011814192208443,A young man met Hillary at the NewsOne town hall and asked: What did you learn from the Girl Scouts that you would use to be a successful president?,,video,https://www.facebook.com/hillaryclinton/videos/1011814192208443/,2015-11-08 10:10:00,9844,641,2334
889307941125736_1011556588900870,You could be Hillary's VIP guest at the next Democratic debate! → http://hrc.io/1kBZdUg,Hillary for Iowa,photo,https://www.facebook.com/HillaryforIA/photos/a.913771128661626.1073741828.911083522263720/1022626881109383/?type=3,2015-11-07 18:50:28,373,421,0
889307941125736_1011494342240428,"“Hillary’s strength is undeniable, and while watching this speech I knew that she would stand up and fight for us on the full range of issues affecting our community.” —Karen Civil",I helped launch African Americans for Hillary Clinton. This is my story.,link,http://hrc.io/1WIb7Iw,2015-11-07 17:00:01,3605,432,393
889307941125736_1011463998910129,“It’s hard for me to understand why the suspension and expulsion rate is so much higher for black kids than for white kids.” —Hillary,,video,https://www.facebook.com/hillaryclinton/videos/1011463998910129/,2015-11-07 14:31:46,6772,816,740
889307941125736_1011388008917728,"“We have to keep our sons’ legacies alive and keep reminding people that they died, and why they died, and that this should not happen again.”",Hillary Clinton sat down with the mothers of Eric Garner and Dontre Hamilton,link,http://hrc.io/1XWdmKF,2015-11-07 11:14:12,8491,622,601
889307941125736_1011361962253666,"Today, Hillary discusses college affordability, gun violence, and the economy at a town hall in Orangeburg, South Carolina hosted by NewsOne’s Roland Martin. Don’t miss it: http://hrc.io/1Qazv6G",Hillary Clinton To Participate In Town Hall Moderated By Roland Martin,link,http://hrc.io/1Qazv6G,2015-11-07 09:58:54,1865,274,149
889307941125736_1011098192280043,Our favorites from the Internet this week.,"What Team Hillary is reading this weekend: First Dudes, preventing gun violence, and women who rock",link,http://hrc.io/1WGiU9K,2015-11-06 21:17:49,4116,602,230
889307941125736_1011043698952159,"Today, Hillary laid out her plan to address criminal justice reform, education, and more in Ebony. Read it here: hrc.io/1NhOuW9",Timeline Photos,photo,https://www.facebook.com/hillaryclinton/photos/a.889773484412515.1073741828.889307941125736/1011043698952159/?type=3,2015-11-06 18:47:42,3766,551,688
889307941125736_1011001792289683,"Blocks away from the New York City projects he grew up in, Mikey’s ice cream shop helps people with criminal records find jobs and rejoin their communities.",Lots of people struggle to find jobs after prison. Mikey's ice cream shop is working to change that.,link,http://hrc.io/1Hi90t4,2015-11-06 16:46:39,6157,380,340
889307941125736_1010880028968526,"Hillary’s spent 40 years in public service, and the numbers speak for themselves.",We quantified Hillary Clinton’s career.,link,http://hrc.io/1NhlA8D,2015-11-06 12:33:43,12454,827,867
889307941125736_1010830212306841,What do you call the male spouse of a female president? Hillary and Jimmy Kimmel Live have some ideas.,,video,https://www.facebook.com/hillaryclinton/videos/1010830212306841/,2015-11-06 10:31:48,8789,1181,1135
889307941125736_1010548672334995,Backstage at Jimmy Kimmel Live—tune in tonight!,Timeline Photos,photo,https://www.facebook.com/hillaryclinton/photos/a.889773484412515.1073741828.889307941125736/1010548672334995/?type=3,2015-11-05 21:31:22,6279,732,374
889307941125736_1010522199004309,“It just meant so much as I got up on that stage looking at all of you.” -Hillary,Hillary for Iowa,video,https://www.facebook.com/HillaryforIA/videos/1021818174523587/,2015-11-05 20:18:13,511,291,0
889307941125736_1010480699008459,#TBT to the time Hillary had a Dolly Parton-themed birthday party in 1995. 🎤,Timeline Photos,photo,https://www.facebook.com/hillaryclinton/photos/a.889773484412515.1073741828.889307941125736/1010480699008459/?type=3,2015-11-05 19:00:00,50035,1696,2362
889307941125736_1010455852344277,"50 years ago, Congressman John Lewis marched—and bled—for the right to vote. His message today: “We must continue to march, to walk. But we must use the vote.”","Congressman John Lewis: ""We must use the vote.""",video,https://www.facebook.com/hillaryclinton/videos/1010455852344277/,2015-11-05 17:05:46,4159,439,929
889307941125736_1010438275679368,"Malala is brave, inspiring—and really onto something here.","Malala and Emma Watson talked feminism, changing the world … and Hillary Clinton.",link,http://hrc.io/1iGgzhs,2015-11-05 16:07:54,15348,562,991
889307941125736_1010373749019154,"Meet Olivia, the 12-year-old feminist who wrote Hillary a heartwarming letter: hrc.io/1XSXuIV

via ABC7NY",Meet Olivia,video,https://www.facebook.com/hillaryclinton/videos/1010373749019154/,2015-11-05 13:13:32,3378,460,491
889307941125736_1010351692354693,Our criminal justice system is broken. Here are 3 things we can do to start fixing it: hrc.io/1Qgrqwk,Timeline Photos,photo,https://www.facebook.com/hillaryclinton/photos/a.889773484412515.1073741828.889307941125736/1010351692354693/?type=3,2015-11-05 12:00:13,2716,660,399
889307941125736_1010054132384449,"If you're on Team Hillary, add your name: hrc.io/1kbUvgo",Hillary Clinton's cover photo,photo,https://www.facebook.com/hillaryclinton/photos/a.891732944216569.1073741831.889307941125736/1010053952384467/?type=3,2015-11-04 20:22:01,6271,1318,385
889307941125736_1010033315719864,Hillary’s answer shows *exactly* what it would mean to have a former secretary of state in the Oval Office.,Hillary Clinton was asked an unexpected foreign policy question on the trail—and she nailed it.,link,http://hrc.io/1kbNn3N,2015-11-04 19:19:58,15236,1113,1331
889307941125736_1009968812392981,"Quick stop at the farmers’ market in Davenport, Iowa for Hillary’s favorite: hot peppers!",Hillary for Iowa,video,https://www.facebook.com/HillaryforIA/videos/1021308864574518/,2015-11-04 16:12:52,5094,565,0
889307941125736_1009922002397662,We need to stand up to the NRA once and for all: “This has gone on too long.”,The Briefing,video,https://www.facebook.com/TheBriefing2016/videos/473748506146837/,2015-11-04 14:10:25,8467,1224,1
889307941125736_1009872085735987,"In 1976, Barbara Walters became the first woman co-anchor on a major news network when she joined the desk of the ABC Evening News. As an on-air personality for ABC News, The Today Show, and ABC 20/20—and the creator and host of The View—Barbara broke barriers for broadcast journalists and introduced the nation to women on prime time. Thank you, Barbara, for your commitment to lifting women up—onscreen and off.",Timeline Photos,photo,https://www.facebook.com/hillaryclinton/photos/a.889773484412515.1073741828.889307941125736/1009872085735987/?type=3,2015-11-04 12:09:16,11260,590,1341
889307941125736_1009607902429072,"Congratulations to 18-year-old Simone Biles, whose gold medal finish at the world gymnastics championship in Glasgow earned her the title of most decorated woman gymnast of all time! Can’t wait to watch your next winning routine, Simone.",USA Gymnastics,video,https://www.facebook.com/USAGymnastics/videos/10152722309937168/,2015-11-03 20:39:26,13103,738,1
889307941125736_1009551032434759,"We’ve made progress, but not enough. → http://hrc.io/CriminalJustice",Timeline Photos,photo,https://www.facebook.com/hillaryclinton/photos/a.889773484412515.1073741828.889307941125736/1009551032434759/?type=3,2015-11-03 18:30:30,3571,843,448
889307941125736_1009472999109229,Watch our new ad—why Hillary is working to prevent gun violence.,Together,video,https://www.facebook.com/hillaryclinton/videos/1009472999109229/,2015-11-03 14:43:39,4709,908,939
889307941125736_1009438775779318,"When unions are strong, America is strong. Thank you, AFSCME.",Timeline Photos,photo,https://www.facebook.com/hillaryclinton/photos/a.889773484412515.1073741828.889307941125736/1009438775779318/?type=3,2015-11-03 13:17:16,10239,975,1211
889307941125736_1009384445784751,The top 25 hedge fund managers make more than all kindergarten teachers in the US—combined. We need to fix that.,Cheryl,video,https://www.facebook.com/hillaryclinton/videos/1009384445784751/,2015-11-03 11:06:09,10128,922,1683
889307941125736_1009111585812037,"A 12-year-old feminist named Olivia wrote Hillary this brave, heartwarming letter. Olivia 2040, anybody?",Timeline Photos,photo,https://www.facebook.com/hillaryclinton/photos/a.889773484412515.1073741828.889307941125736/1009111585812037/?type=3,2015-11-02 21:39:58,31384,1340,2617
889307941125736_1009075442482318,Their faces say it all. hrc.io/20p4C1L,10 little girls who are ready for the first woman president,link,http://hrc.io/20p4C1L,2015-11-02 19:49:40,7427,626,430
889307941125736_1009038985819297,“We need to end private prisons and detention centers once and for all. Protecting public safety is the core responsibility of the government and it should never be outsourced or left to unaccountable corporations.” —Hillary in Atlanta,Timeline Photos,photo,https://www.facebook.com/hillaryclinton/photos/a.889773484412515.1073741828.889307941125736/1009038985819297/?type=3,2015-11-02 18:09:09,8120,646,640
889307941125736_1009005145822681,"This Tuesday, Houston will vote on whether to ensure vital protections for discrimination on the basis of sexual orientation, gender identity, race, religion, veteran status, and more. Support equality for all and be a #HERO: Sign up to volunteer for a phone banking shift to ask Houstonians to vote #YesOnProp1. http://hrc.io/1GZf61o",Houston Equal Rights Ordinance,link,http://hrc.io/1GZf61o,2015-11-02 16:45:07,475,310,109
889307941125736_1008948742494988,"“I will fight to end the era of mass incarceration. We have 5 percent of the world’s population and 25 percent of the world’s prison population. Many Americans behind bars right now are low-level offenders, predominantly drug users. Keeping them in prison does little to reduce crime, but it does a lot to tear families and communities apart. Right now, one out of every 28 children in America has a parent in prison. You talk about the pipeline that goes from the cradle to prison; it starts when a family is broken up for no real reason. And I’ll tell you something else: We need to get rid of private prisons and detention centers. The power to keep people locked up should not be in the hands of unaccountable corporations. … I also want us to eliminate finally the disparity in sentencing between crack and cocaine. It keeps our prisons full and unfairly impacts African Americans. We’ve made progress on it in the last years, but not enough. I will fight to make it easier for people who have done their time to rebuild their lives.” —Hillary in Charleston, SC",,status,,2015-11-02 14:49:52,3457,560,361
889307941125736_1008893122500550,"On the day of the first Democratic debate, Hillary’s granddaughter Charlotte had a big surprise for her.",Quick Question: Has your granddaughter done or said anything t...,video,https://www.facebook.com/hillaryclinton/videos/1008893122500550/,2015-11-02 12:23:46,14240,789,1160
889307941125736_1008871742502688,¡Feliz Día de los Muertos! Envía LATINOS al 47246 para unirte a la campaña de Hillary.,Timeline Photos,photo,https://www.facebook.com/hillaryclinton/photos/a.889773484412515.1073741828.889307941125736/1008871742502688/?type=3,2015-11-02 11:32:50,4481,312,264
889307941125736_1008565265866669,Our criminal justice system is out of balance–but there are three things we can do right now to start changing that.,More than 1 in 100 American adults is behind bars. Here’s how we fix that.,link,http://hrc.io/1Shv1cL,2015-11-01 21:03:05,2874,593,260
889307941125736_1008519409204588,“I support Hillary because Hillary supports me.” Orange Is the New Black's Uzo Aduba and Dascha Polanco are on Team Hillary.,,video,https://www.facebook.com/hillaryclinton/videos/1008519409204588/,2015-11-01 19:02:30,5380,519,610
889307941125736_1008485329207996,"An inside look at an issue that will shape our economy for years to come (yeah, it’s that important).",What needs to change about Wall Street in 6 words (and some charts),link,http://hrc.io/1MrAOHl,2015-11-01 17:23:16,3591,445,452
889307941125736_1008412902548572,"While Republicans swapped out-of-touch ideas at the #GOPdebate, Hillary was live-texting her reactions.",Did you see the text messages Hillary Clinton sent during the Republican debate?,link,http://hrc.io/1PevSef,2015-11-01 14:32:15,4224,583,194
889307941125736_1008354025887793,Top CEOs earn 300 times more than the typical American worker. That's wrong.,Mindy,video,https://www.facebook.com/hillaryclinton/videos/1008354025887793/,2015-11-01 12:34:49,4740,620,782
889307941125736_1008278532562009,Happy to have New York City's Mayor Bill de Blasio on Team Hillary.,Timeline Photos,photo,https://www.facebook.com/hillaryclinton/photos/a.889773484412515.1073741828.889307941125736/1008278532562009/?type=3,2015-11-01 09:51:46,16768,1329,1424
889307941125736_1008009922588870,Happy Halloween! 🎃,Timeline Photos,photo,https://www.facebook.com/hillaryclinton/photos/a.889773484412515.1073741828.889307941125736/1008009922588870/?type=3,2015-10-31 20:00:20,112761,3190,3003
889307941125736_1007933569263172,"Too often, women still make less on the dollar than men. It's time for equal pay now.",Sara,video,https://www.facebook.com/hillaryclinton/videos/1007933569263172/,2015-10-31 16:08:10,3710,510,536
889307941125736_1007874662602396,"This week, Republican candidates took the stage for their third presidential debate of the primary season. We took the liberty of translating what they said into what they actually meant.",What Republican candidates said at last night’s debate—and what they really meant,link,https://www.hillaryclinton.com/feed/what-republican-candidates-said-last-nights-debateand-what-they-really-meant/?utm_medium=social&utm_source=fb&utm_campaign=2015103120151031_fb_share,2015-10-31 13:29:34,3444,590,215
889307941125736_1007819649274564,"""As a South Carolinian, an African American man, and a father, I can't stop asking myself once again: Where does my community go from here?"" Clay Middleton, Hillary for South Carolina State Director, on the #AssaultAtSpringValleyHigh.",Where does South Carolina go from here?,link,http://hrc.io/1Mzadyw,2015-10-31 10:55:12,2683,367,125
889307941125736_1007460165977179,"Come on over to a party at Christina Aguilera's house! Enter your name for the chance to win a free plane ticket, hotel stay, and bragging rights.",Meet Hillary at Christina Aguilera's,link,http://hrc.io/1LHiEUQ,2015-10-30 19:31:00,2045,582,232
889307941125736_1007406442649218,Race still plays a role in who gets ahead and who gets held back. Hillary will fight to change that. Join her: hrc.io/1LH26fL,Timeline Photos,photo,https://www.facebook.com/hillaryclinton/photos/a.889773484412515.1073741828.889307941125736/1007406442649218/?type=3,2015-10-30 15:30:22,5697,926,557
889307941125736_1007381932651669,It's intolerable that black children in our country feel unsafe in their own skin. A powerful reminder: http://hrc.io/1MZVzdP -H,Where Are Black Children Safe?,link,http://hrc.io/1MZVzdP,2015-10-30 13:37:04,5777,789,495
889307941125736_1007366412653221,Rated “O” for out of touch and out of date: The Zombie Policies.,The Briefing,video,https://www.facebook.com/TheBriefing2016/videos/472538562934498/,2015-10-30 12:53:40,3958,642,3
889307941125736_1007301612659701,40 million Americans have student debt. We need to make college affordable once and for all.,Alexis,video,https://www.facebook.com/hillaryclinton/videos/1007301612659701/,2015-10-30 10:29:45,6522,715,743
889307941125736_1007278885995307,"Whether you're a teacher, an executive, or a world-champion soccer player, you deserve equal pay. Red card, GOP.",Republican Blocks Measure Urging Equal Pay For Female Soccer Players,link,http://hrc.io/1ScqEzA,2015-10-30 09:30:32,9481,677,1187
889307941125736_1007002356022960,"If you watched yesterday’s debate, you know we can’t afford to have a Republican in the White House. Say you're with Hillary—add your name: http://hrc.io/1NbCv0H",Timeline Photos,photo,https://www.facebook.com/hillaryclinton/photos/a.889773484412515.1073741828.889307941125736/1007002356022960/?type=3,2015-10-29 21:10:12,8356,1235,933
889307941125736_1007001409356388,An estimated 1.5 million black men are missing from their communities because of incarceration and premature death.,Timeline Photos,photo,https://www.facebook.com/hillaryclinton/photos/a.889773484412515.1073741828.889307941125736/1007001409356388/?type=3,2015-10-29 18:30:20,9820,903,1338
889307941125736_1006907236032472,Read the texts Hillary sent some friends last night during the GOP debate.,Did you see the text messages Hillary Clinton sent during the Republican debate?,link,http://hrc.io/1Ml7ulU,2015-10-29 15:19:21,9044,854,472
889307941125736_1006902082699654,"""Despite our best efforts and our highest hopes, America’s long struggle with race is far from finished ... I know there are truths we don’t like to say out loud or discuss with our children. But we have to. That’s the only way we can possibly move forward together."" —Hillary",,status,,2015-10-29 14:12:13,6674,567,404
889307941125736_1006819236041272,"Why do Orange Is the New Black's Uzo Aduba and Dascha Polanco support Hillary Clinton? “She cares about the things that are important to us.""",Orange Is the New Black: Uzo and Dascha for Hillary,video,https://www.facebook.com/hillaryclinton/videos/1006819236041272/,2015-10-29 11:21:58,5563,563,697
889307941125736_1006746009381928,"“Do you think that when you’re president, you’ll be paid as much as a man?”",The Same,video,https://www.facebook.com/hillaryclinton/videos/1006746009381928/,2015-10-29 08:30:02,39738,1750,12389
889307941125736_1006499739406555,Agree? Get your free sticker: http://hrc.io/1RBSa8O #GOPDebate,Free Sticker: We cannot afford a Republican in the White House,link,http://hrc.io/1RBSa8O,2015-10-28 21:22:17,18441,1537,1478
889307941125736_1006491762740686,Ya basta con los Re-Trumplicanos. #GOPDebate,Timeline Photos,photo,https://www.facebook.com/hillaryclinton/photos/a.889773484412515.1073741828.889307941125736/1006491762740686/?type=3,2015-10-28 20:52:21,6978,724,1015
889307941125736_1006489776074218,"For people who claim to hate big government, Republicans love using it to try and make health care decisions for women. #GOPdebate",Hillary Clinton,video,https://www.facebook.com/hillaryclinton/videos/998099750246554/,2015-10-28 20:45:44,13175,720,1
889307941125736_1006474436075752,Text WATCH to 47246 to get live texts from Hillary during the #GOPDebate!,Timeline Photos,photo,https://www.facebook.com/hillaryclinton/photos/a.889773484412515.1073741828.889307941125736/1006474436075752/?type=3,2015-10-28 20:08:17,4131,514,258
889307941125736_1006469046076291,Republicans' ideas are trickle-down economics in disguise. We can't let them take us back to policies that don't work. #GOPDebate,Hillary Clinton,video,https://www.facebook.com/hillaryclinton/videos/998844613505401/,2015-10-28 19:53:00,8402,646,0
889307941125736_1006428156080380,Which GOP candidate would you want to see Hillary take on in a debate? Cast your vote! http://hrc.io/1HcsZnw,Who should Hillary debate?,link,http://hrc.io/1HcsZnw,2015-10-28 17:50:13,1956,1437,190
